"Code 4-digit","Section Code","Part 2-digit","Part 4-digit","Product Name","Nom du produit"
"8302","Type 15","83","02","Base metal mountings, fittings and similar articles for furniture, doors, staircases, windows, trunks, chests etc, castors with mountings of base metal, automatic door closers of base metal","Garnitures, ferrures et articles similaires en métaux communs pour meubles, portes, escaliers, fenêtres, coffres, coffres, etc., roulettes avec montures en métaux communs, ferme-portes automatiques en métaux communs"
"8303","Type 15","83","03","Safes; armoured or reinforced, strong-boxes, doors and safe deposit lockers for strong-rooms, cash or deed boxes and the like, of base metal","Coffres-forts ; blindés ou renforcés, coffres-forts, portes et coffres-forts pour chambres fortes, coffres-forts ou coffres-forts et similaires, en métaux communs"
"8304","Type 15","83","04","Office equipment; filing cabinets, card-index cabinets, paper trays and rests, pen trays, office-stamp stands and the like, of base metal, other than office furniture of heading no. 9403","Matériel de bureau ; classeurs, classeurs à fiches, corbeilles et repose-papiers, plumiers, présentoirs pour timbres de bureau et articles similaires, en métaux communs, autres que les meubles de bureau du no. 9403"
"8305","Type 15","83","05","Stationery; fittings for loose-leaf binders or files, letter clips, letter corners, paper clips, indexing tags and the like, staples in strips (for offices, upholstery, packaging), of base metal","Papeterie ; accessoires pour reliures à feuilles mobiles ou classeurs, trombones, coins de lettres, trombones, étiquettes d'indexation et similaires, agrafes en bandes (de bureau, de rembourrage, d'emballage), en métaux communs"
"8306","Type 15","83","06","Bells, gongs and the like; non-electric, statuettes, other ornaments, photograph, picture, similar frames, mirrors, of base metal","Cloches, gongs et similaires ; non électriques, statuettes, autres ornements, photographies, tableaux, cadres similaires, miroirs, en métaux communs"
"8307","Type 15","83","07","Tubing; flexible, with or without fittings, of base metal","Tubes ; flexible, avec ou sans accessoires, en métaux communs"
"8308","Type 15","83","08","Clasps; frames with clasps, buckles, hooks, eyes, eyelets etc used for clothing, footwear, awnings, handbags, travel goods or other articles, tubular, bifurcated rivets, beads, spangles, of base metal","Fermoirs ; cadres avec fermoirs, boucles, crochets, oeillets, oeillets, etc. pour vêtements, chaussures, auvents, sacs à main, articles de voyage ou autres articles, rivets tubulaires, bifurqués, perles, paillettes, en métaux communs"
"8309","Type 15","83","09","Stoppers, caps, lids (including crown corks, screw caps, pouring stoppers); capsules for bottles, threaded bungs, bung covers, seals and other packaging accessories, of base metal","Bouchons, capsules, couvercles (y compris bouchons-couronnes, capsules à vis, bouchons verseurs) ; capsules pour bouteilles, bouchons filetés, couvercles de bonde, joints et autres accessoires d'emballage, en métaux communs"
"8310","Type 15","83","10","Sign plates, name plates, address plates and similar plates, numbers, letters and other symbols, of base metal, excluding those of heading no. 9405","Plaques d'enseignes, plaques signalétiques, plaques-adresses et plaques similaires, chiffres, lettres et autres symboles, en métaux communs, à l'exclusion de ceux du n°9405"
"8311","Type 15","83","11","Wires, rods, tubes, plates, electrodes of base metal or metal carbides; of a kind used for soldering, brazing, welding; wires and rods for metal spraying","Fils, tiges, tubes, plaques, électrodes en métaux communs ou en carbures métalliques ; des types utilisés pour le brasage, le brasage, le soudage ; fils et tiges pour métallisation au pistolet"
"8401","Type 16","84","01","Nuclear reactors; fuel elements (cartridges), non-irradiated, for nuclear reactors, machinery and apparatus for isotopic separation","Réacteurs nucléaires ; éléments combustibles (cartouches), non irradiés, pour réacteurs nucléaires, machines et appareils de séparation isotopique"
"8402","Type 16","84","02","Boilers; steam or other vapour generating (other than central heating hot water boilers, capable also of producing low pressure steam), super heated water boilers","Chaudières ; vapeur ou autres générateurs de vapeur (autres que les chaudières à eau chaude pour le chauffage central, capables également de produire de la vapeur à basse pression), chaudières à eau surchauffée"
"8403","Type 16","84","03","Central heating boilers; excluding those of heading no. 8402","Chaudières de chauffage central  ; à l'exclusion de ceux du no. 8402"
"8404","Type 16","84","04","Auxiliary plant for use with boilers of heading no. 8402 or 8403; eg economisers, super-heaters, soot removers, gas recoverers), condensers for steam or other vapour power units","Installation auxiliaire à utiliser avec les chaudières de la position no. 8402 ou 8403  ; ex. économiseurs, surchauffeurs, éliminateurs de suie, récupérateurs de gaz), condenseurs pour vapeur ou autres centrales à vapeur"
"8405","Type 16","84","05","Generators for producer or water gas with or without their purifiers acetylene gas generators and similar water process gas generators, with or without their purifiers","Générateurs pour générateur ou gaz à l'eau avec ou sans leurs épurateurs générateurs de gaz acétylène et générateurs de gaz similaires à l'eau, avec ou sans leurs épurateurs"
"8406","Type 16","84","06","Turbines; steam and other vapour turbines","Éoliennes  ; turbines à vapeur et autres turbines à vapeur"
"8407","Type 16","84","07","Reciprocating or rotary internal combustion piston engines","Moteurs à piston alternatifs ou rotatifs à combustion interne"
"8408","Type 16","84","08","Compression-ignition internal combustion piston engines (diesel or semi-diesel engines)","Moteurs à piston à allumage par compression (moteurs diesel ou semi-diesel)"
"8409","Type 16","84","09","Parts suitable for use solely or principally with the engines of heading no. 8407 or 8408","Parties reconnaissables comme étant exclusivement ou principalement destinées aux moteurs de la position no. 8407 ou 8408"
"8410","Type 16","84","10","Turbines; hydraulic water wheels and regulators therefor","Éoliennes  ; roues hydrauliques hydrauliques et leurs régulateurs."
"8411","Type 16","84","11","Turbo-jets, turbo-propellers and other gas turbines","Turboréacteurs, turbopropulseurs et autres turbines à gaz"
"8412","Type 16","84","12","Engines and motors; n.e.s. (eg reaction engines, hydraulic power engines, pneumatic power engines)","Moteurs et moteurs ; n.c.a. (par exemple moteurs à réaction, moteurs hydrauliques, moteurs pneumatiques)"
"8413","Type 16","84","13","Pumps; for liquids, whether or not fitted with measuring device, liquid elevators","Pompes  ; pour liquides, même munis d'un dispositif de mesure, élévateurs de liquide"
"8414","Type 16","84","14","Air or vacuum pumps, air or other gas compressors and fans; ventilating or recycling hoods incorporating a fan whether or not fitted with filters","Pompes à air ou à vide, compresseurs d'air ou d'autres gaz et ventilateurs  ; hottes de ventilation ou de recyclage incorporant un ventilateur muni ou non de filtres"
"8415","Type 16","84","15","Air conditioning machines; comprising a motor driven fan and elements for changing the temperature and humidity, including those machines in which the humidity cannot be separately regulated","Appareils de climatisation ; comprenant un ventilateur entraîné par un moteur et des éléments pour modifier la température et l'humidité, y compris les machines dans lesquelles l'humidité ne peut pas être régulée séparément"
"8416","Type 16","84","16","Furnace burners for liquid fuel, for pulverised solid fuel or for gas; mechanical grates, mechanical ash dischargers and similar appliances","Brûleurs de fours à combustible liquide, à combustible solide pulvérisé ou à gaz ; grilles mécaniques, déchargeurs de cendres mécaniques et appareils similaires"
"8417","Type 16","84","17","Furnaces and ovens; industrial or laboratory, including incinerators, non-electric","Fours et étuves  ; industriels ou de laboratoire, y compris les incinérateurs, non électriques"
"8418","Type 16","84","18","Refrigerators, freezers and other refrigerating or freezing equipment, electric or other; heat pumps other than air conditioning machines of heading no. 8415","Réfrigérateurs, congélateurs et autres équipements de réfrigération ou de congélation, électriques ou autres  ; pompes à chaleur autres que les machines de conditionnement d'air du no. 8415"
"8419","Type 16","84","19","Machinery, plant or laboratory equipment for the treatment of materials by a process involving change of temperature (ie heating, cooking, etc); instantaneous or storage water heaters, non-electric","Machines, équipements d'usine ou de laboratoire pour le traitement de matériaux par un processus impliquant un changement de température (c'est-à-dire chauffage, cuisson, etc.) ; chauffe-eau instantanés ou à accumulation, non électriques"
"8420","Type 16","84","20","Machines; calendering or other rolling machines, for other than metal or glass and cylinders therefor","Machines ; calandreuses ou autres laminoirs, autres que pour le métal ou le verre et leurs cylindres"
"8421","Type 16","84","21","Centrifuges, including centrifugal dryers; filtering or purifying machinery and apparatus for liquids or gases","Centrifugeuses, y compris séchoirs centrifuges ; machines et appareils pour la filtration ou l'épuration des liquides ou des gaz"
"8422","Type 16","84","22","Dish washing machines; machinery for cleaning, drying, filling, closing, sealing, capsuling or labelling bottles, cans, boxes, bags, etc, machinery for aerating beverages","Lave-vaisselle ; machines pour nettoyer, sécher, remplir, fermer, sceller, capsuler ou étiqueter les bouteilles, canettes, boîtes, sacs, etc., machines pour aérer les boissons"
"8423","Type 16","84","23","Weighing machines; excluding balances of a sensitivity of 5cg or better, including weight operated counting or checking machines and weights of all kinds","Balances ; à l'exclusion des balances d'une sensibilité égale ou supérieure à 5 cg, y compris les machines de comptage ou de contrôle à poids et les poids de toutes sortes"
"8424","Type 16","84","24","Mechanical appliances for projecting, dispersing or spraying liquids or powders; fire extinguishers, spray guns, steam, sand blasting machines","Appareils mécaniques à projeter, disperser ou pulvériser des liquides ou des poudres ; extincteurs, pistolets pulvérisateurs, vapeur, sableuses"
"8425","Type 16","84","25","Pulley tackle and hoists other than skip hoists; winches and capstans; jacks","Palans à poulie et palans autres que les palans à benne  ; treuils et cabestans ; crics"
"8426","Type 16","84","26","Derricks, cranes, including cable cranes, mobile lifting frames, straddle carriers and works trucks fitted with a crane","Derricks, grues, y compris grues à câble, châssis de levage mobiles, chariots cavaliers et chariots de chantier équipés d'une grue"
"8427","Type 16","84","27","Fork-lift and other works trucks; fitted with lifting or handling equipment","Chariots élévateurs et autres chariots de travaux  ; équipés de matériel de levage ou de manutention"
"8428","Type 16","84","28","Lifting, handling, loading or unloading machinery (eg lifts, escalators, conveyors, teleferics)","Machines de levage, de manutention, de chargement ou de déchargement (par exemple ascenseurs, escaliers mécaniques, convoyeurs, téléphériques)"
"8429","Type 16","84","29","Bulldozers, graders, levellers, scrapers, angledozers, mechanical shovels, excavators, shovel loaders, tamping machines and road rollers, self-propelled","Bulldozers, niveleuses, niveleuses, grattoirs, angledozers, pelles mécaniques, excavatrices, chargeuses-pelleteuses, bourreuses et rouleaux compresseurs, automoteurs"
"8430","Type 16","84","30","Moving, grading, levelling, scraping, excavating, tamping, compacting, extracting or boring machinery, for earth, minerals, or ores; pile drivers and extractors; snow ploughs and snow blowers","Machines de déplacement, de nivellement, de nivellement, de grattage, d'excavation, de bourrage, de compactage, d'extraction ou de forage, pour la terre, les minéraux ou les minerais  ; batteurs de pieux et extracteurs ; chasse-neige et souffleuses à neige"
"8431","Type 16","84","31","Machinery parts; used solely or principally with the machinery of heading no. 8425 to 8430","Pièces de machines ; utilisé uniquement ou principalement avec les machines du no. 8425 à 8430"
"8432","Type 16","84","32","Agricultural, horticultural or forestry machinery for soil preparation or cultivation; lawn or sports-ground rollers","Machines agricoles, horticoles ou forestières pour la préparation ou la culture du sol ; rouleaux de gazon ou de terrain de sport"
"8433","Type 16","84","33","Harvesting and threshing machinery, straw and fodder balers, grass or hay mowers; machines for cleaning, sorting or grading eggs, fruit or other agricultural produce, other than machinery of heading no 8437","Machines de récolte et de battage, presses à balles de paille et de fourrage, faucheuses à herbe ou à foin  ; machines à nettoyer, trier ou calibrer les oeufs, les fruits ou d'autres produits agricoles, autres que les machines du n°8437"
"8434","Type 16","84","34","Milking machines and dairy machinery","Machines à traire et machines laitières"
"8435","Type 16","84","35","Presses, crushers and similar machinery; used in the manufacture of wine, cider, fruit juices or similar beverages","Presses, broyeurs et machines similaires  ; utilisé dans la fabrication de vin, de cidre, de jus de fruits ou de boissons similaires"
"8436","Type 16","84","36","Agricultural, horticultural, forestry, poultry-keeping, bee-keeping machinery; including germination plant fitted with mechanical or thermal equipment; poultry incubators and brooders","Machines agricoles, horticoles, forestières, avicoles, apicoles ; y compris les germoirs équipés d'équipements mécaniques ou thermiques  ; incubateurs et éleveuses de volaille"
"8437","Type 16","84","37","Machines for cleaning, sorting, grading seed, grain, dried leguminous vegetables; machinery used in the milling industry for the working of cereals or dried leguminous vegetables, not farm type machinery","Machines pour nettoyer, trier, classer les semences, les céréales, les légumes à cosse séchés ; machines utilisées dans l'industrie meunière pour le travail des céréales ou des légumes à cosse secs, à l'exception des machines de type agricole"
"8438","Type 16","84","38","Machinery n.e.s. in this chapter, for the industrial preparation or manufacture of food or drink; other than machinery for extraction or preparation of animal or fixed vegetable fats or oils","Machines n.d.a. dans le présent chapitre, pour la préparation ou la fabrication industrielle d'aliments ou de boissons  ; autres que les machines pour l'extraction ou la préparation de graisses ou d'huiles animales ou végétales fixes"
"8439","Type 16","84","39","Machinery; for making pulp of fibrous cellulosic material, or for making or finishing paper or paperboard","Machinerie ; pour la fabrication de pâte de matière cellulosique fibreuse, ou pour la fabrication ou la finition de papier ou de carton"
"8440","Type 16","84","40","Book-binding machinery; including book-sewing machines","Machines à relier ; y compris les machines à coudre les livres"
"8441","Type 16","84","41","Machines; for making up paper pulp, paper or paperboard, including cutting machines of all kinds","Machines ; pour la fabrication de pâte à papier, de papier ou de carton, y compris les machines de découpe de tous types"
"8442","Type 16","84","42","Machinery and apparatus; for type founding or type-setting (excluding machine tools of heading no. 8456 to 8465), printing type, blocks, plates, cylinders and lithographic stones","Machines et appareils ; à fondre ou à composer (à l'exclusion des machines-outils des nos 8456 à 8465), des caractères d'imprimerie, des blocs, des plaques, des cylindres et des pierres lithographiques"
"8443","Type 16","84","43","Printing machinery; machines for uses ancillary to printing","Machines d'impression ; machines pour des usages annexes à l'imprimerie"
"8444","Type 16","84","44","Textile machinery; for extruding, drawing, texturing or cutting man-made textile materials","Machines textiles ; pour extruder, étirer, texturer ou couper des matières textiles synthétiques"
"8445","Type 16","84","45","Textile machinery; spinning, doubling, twisting machines, textile reeling or winding machines and machines for preparing textile yarns for use on machines of heading no. 8446 and 8447","Machines textiles ; machines à filer, doubler, retorder, dévidoirs ou bobinoirs pour textiles et machines pour la préparation de fils textiles destinés à être utilisés sur des machines du no. 8446 et 8447"
"8446","Type 16","84","46","Weaving machines (looms)","Machines à tisser (métiers)"
"8447","Type 16","84","47","Knitting machines, stitch-bonding machines and machines for making gimped yarn, tulle, lace, embroidery, trimmings, braid or net and machines for tufting","Machines à tricoter, machines à coudre et machines pour la fabrication de fil guipé, de tulle, de dentelle, de broderie, de passementerie, de passementerie ou de filet et machines à tufter"
"8448","Type 16","84","48","Machinery, auxiliary; for use with machines of heading no. 8444 to 8447 (eg dobbies, jaquards, automatic stop motions, shuttle changing mechanisms) parts, accessories for machines of heading no. 8444, 8447","Machines auxiliaires  ; à utiliser avec les machines du no. 8444 à 8447 (par exemple ratières, jaquards, stop motions automatiques, mécanismes de changement de navette) parties, accessoires pour machines du no. 8444, 8447"
"8449","Type 16","84","49","Machinery; for manufacture or finishing felt or non-wovens in the piece or in shapes, including machinery for making felt hats, blocks for making hats","Machinerie ; pour la fabrication ou le finissage du feutre ou des non-tissés en pièces ou en formes, y compris les machines pour la fabrication de chapeaux en feutre, les blocs pour la fabrication de chapeaux"
"8450","Type 16","84","50","Household or laundry-type washing machines; including machines which both wash and dry","Machines à laver domestiques ou de type blanchisserie ; y compris les machines qui lavent et sèchent"
"8451","Type 16","84","51","Machinery (not of heading no. 8450) for washing, cleaning, wringing, drying, ironing, pressing, bleaching, dyeing, dressing, finishing, coating or impregnating textile yarn, fabrics or made up articles","Machines (hors n°8450) pour laver, nettoyer, essorer, sécher, repasser, presser, blanchir, teindre, apprêter, finir, enduire ou imprégner les fils, tissus ou articles confectionnés en matières textiles"
"8452","Type 16","84","52","Sewing machines; other than book-sewing machines of heading no. 8440; furniture, bases and covers specially designed for sewing machines; sewing machine needles","Machines à coudre ; autres que les machines à coudre les livres du no. 8440  ; meubles, socles et couvercles spécialement conçus pour machines à coudre ; aiguilles pour machine à coudre"
"8453","Type 16","84","53","Machinery for preparing, tanning or working hides, skins or leather or for making or repairing footwear or other articles of hides, skins or leather, other than sewing machines","Machines et appareils pour la préparation, le tannage ou le travail des cuirs ou pour la fabrication ou la réparation de chaussures ou d'autres articles en cuir, autres que les machines à coudre"
"8454","Type 16","84","54","Converters, ladles, ingot moulds and casting machines; of a kind used metallurgy or in metal foundries","Convertisseurs, poches, lingotières et machines de coulée  ; d'un type utilisé en métallurgie ou en fonderie de métaux"
"8455","Type 16","84","55","Metal-rolling mills and rolls therefor","Laminoirs à métaux et leurs rouleaux"
"8456","Type 16","84","56","Machine-tools; for working any material by removal of material, by laser, other light or photon beam, ultrasonic, electro-discharge, electro-chemical, electron beam, ionic beam or plasma arc processes","Des machines-outils ; pour le travail de tout matériau par enlèvement de matière, par laser, autre faisceau de lumière ou de photons, ultrasons, électrodécharge, électrochimique, faisceau d'électrons, faisceau ionique ou arc plasma"
"8457","Type 16","84","57","Machining centres, unit construction machines (single station) and multi-station transfer machines for working metal","Centres d'usinage, machines de construction unitaire (monoposte) et machines transfert multipostes pour l'usinage des métaux"
"8458","Type 16","84","58","Lathes for removing metal","Tours pour enlever le métal"
"8459","Type 16","84","59","Machine-tools; (including way-type unit head machines) for drilling, boring, milling, threading or tapping by removing metal, other than lathes of heading no. 8458","Des machines-outils ; (y compris les machines à tête unitaire à voies) pour le perçage, l'alésage, le fraisage, le filetage ou le taraudage par enlèvement de métal, autres que les tours du no. 8458"
"8460","Type 16","84","60","Machine-tools; for deburring, sharpening, grinding, honing, lapping, polishing or otherwise finishing metal, sintered metal carbides or cermets by means of grinding stones, abrasives or polishing products","Des machines-outils ; pour ébavurer, affûter, meuler, roder, roder, polir ou autrement finir le métal, les carbures métalliques frittés ou les cermets au moyen de meules, d'abrasifs ou de produits de polissage"
"8461","Type 16","84","61","Machine-tools; for planing, shaping, slotting, broaching, gear cutting and grinding, finishing, sawing, cutting off and other tools working by removing metal, sintered metal carbides or cermets n.e.s.","Des machines-outils ; pour le rabotage, le façonnage, le rainurage, le brochage, le taillage et le meulage d'engrenages, la finition, le sciage, le tronçonnage et d'autres outils travaillant par enlèvement de métal, de carbures métalliques frittés ou de cermets n.d.a."
"8462","Type 16","84","62","Machine-tools; (including presses) for working metal by forging, hammering or die-stamping, for bending, folding, straightening, flattening, shearing or punching metal","Des machines-outils ; (y compris les presses) pour le travail des métaux par forgeage, martelage ou matriçage, pour cintrer, plier, redresser, planer, cisailler ou poinçonner le métal"
"8463","Type 16","84","63","Machine-tools; n.e.s. for working metal, sintered metal carbides or cermets without removing material","Des machines-outils ; n.c.a. pour travailler le métal, les carbures métalliques frittés ou les cermets sans enlèvement de matière"
"8464","Type 16","84","64","Machine-tools; for working stone, ceramics, concrete, asbestos-cement or like mineral materials or for cold working glass","Des machines-outils ; pour le travail de la pierre, de la céramique, du béton, de l'amiante-ciment ou des matériaux minéraux similaires ou pour le travail à froid du verre"
"8465","Type 16","84","65","Machine-tools; (including machines for nailing, stapling, glueing or otherwise assembling) for working wood, cork, bone, hard plastics or rubber or similar hard materials","Des machines-outils ; (y compris les machines à clouer, agrafer, coller ou autrement assembler) pour le travail du bois, du liège, de l'os, des matières plastiques dures ou du caoutchouc ou de matières dures similaires"
"8466","Type 16","84","66","Machine-tools; parts suitable for use with the machines of heading no. 8456 to 8465, work or tool holders, self-opening dieheads, dividing heads and other attachments","Des machines-outils ; parties utilisables avec les machines du no. 8456 à 8465, porte-pièces ou porte-outils, filières à ouverture automatique, diviseurs et autres accessoires"
"8467","Type 16","84","67","Tools for working in the hand, pneumatic or with self-contained non-electric motor","Outils pour travail à la main, pneumatiques ou à moteur autonome non électrique"
"8468","Type 16","84","68","Machinery and apparatus for soldering, brazing, welding, whether or not capable of cutting, other than those of heading no. 8515; gas-operated surface tempering machines and appliances","Machines et appareils pour le brasage, le brasage, le soudage, même capables de couper, autres que ceux du no. 8515  ; machines et appareils de trempe superficielle fonctionnant au gaz"
"8469","Type 16","84","69","Typewriters and word-processing machines","Machines à écrire et machines de traitement de texte"
"8470","Type 16","84","70","Calculating machines, accounting machines, cash registers, postage-franking machines, ticket-issuing machines and similar machines, incorporating a calculating device","Machines à calculer, machines comptables, caisses enregistreuses, machines à affranchir, machines à émettre des billets et machines similaires, incorporant un dispositif de calcul"
