"Code 4-digit","Section Code","Part 2-digit","Part 4-digit","Product Name","Nom du produit"
"0101","Type 1","01","01","Horses, asses, mules and hinnies; live","Chevaux, ânes, mules et bardots  ; vivants"
"0102","Type 1","01","02","Bovine animals; live","Bovins ; vivants"
"0103","Type 1","01","03","Swine; live","Porc ; vivants"
"0104","Type 1","01","04","Sheep and goats; live","Moutons et chèvres ; vivants"
"0105","Type 1","01","05","Poultry; live, fowls of the species gallus domesticus, ducks, geese, turkeys and guinea fowls","La volaille ; vivants, volailles de l'espèce gallus domesticus, canards, oies, dindes et pintades"
"0106","Type 1","01","06","Animals, n.e.s. in chapter 01; live","Animaux, n.d.a. au chapitre 01  ; vivants"
"0201","Type 1","02","01","Meat of bovine animals; fresh or chilled","Viande de bovins ; frais ou réfrigéré"
"0202","Type 1","02","02","Meat of bovine animals; frozen","Viande de bovins ; gelé"
"0203","Type 1","02","03","Meat of swine; fresh, chilled or frozen","Viande de porc ; frais, réfrigéré ou surgelé"
"0204","Type 1","02","04","Meat of sheep or goats; fresh, chilled or frozen","Viande de mouton ou de chèvre ; frais, réfrigéré ou surgelé"
"0205","Type 1","02","05","Meat of horses, asses, mules or hinnies; fresh, chilled or frozen","Viande de chevaux, d'ânes, de mulets ou de bardots ; frais, réfrigéré ou surgelé"
"0206","Type 1","02","06","Edible offal of bovine animals, swine, sheep, goats, horses, asses, mules or hinnies; fresh, chilled or frozen","Abats comestibles de bovins, de porcs, de moutons, de chèvres, de chevaux, d'ânes, de mulets ou de bardots  ; frais, réfrigéré ou surgelé"
"0207","Type 1","02","07","Meat and edible offal of poultry; of the poultry of heading no. 0105, (ie fowls of the species gallus domesticus), fresh, chilled or frozen","Viande et abats comestibles de volaille ; des volailles du no. 0105, (c'est-à-dire volailles de l'espèce gallus domesticus), frais, réfrigérés ou congelés"
"0208","Type 1","02","08","Meat and edible meat offal, n.e.s. in chapter 2; fresh, chilled or frozen","Viandes et abats comestibles, n.d.a. au chapitre 2 ; frais, réfrigéré ou surgelé"
"0209","Type 1","02","09","Pig fat, free of lean meat, and poultry fat, (not rendered), fresh, chilled, frozen, salted, in brine, dried or smoked","Graisse de porc sans viande maigre et graisse de volaille (non fondue), fraîche, réfrigérée, congelée, salée, en saumure, séchée ou fumée"
"0210","Type 1","02","10","Meat and edible meat offal; salted, in brine, dried or smoked; edible flours and meals of meat or meat offal","Viande et abats comestibles ; salé, en saumure, séché ou fumé ; farines et semoules comestibles de viande ou d'abats"
"0301","Type 1","03","01","Fish; live","Poisson ; vivants"
"0302","Type 1","03","02","Fish; fresh or chilled (excluding fish fillets and other fish meat of heading no. 0304)","Poisson ; frais ou réfrigéré (à l'exclusion des filets de poissons et autre chair de poissons du n°0304)"
"0303","Type 1","03","03","Fish; frozen (excluding fish fillets and other fish meat of heading no. 0304)","Poisson ; congelés (à l'exclusion des filets de poissons et autre chair de poissons du n°0304)"
"0304","Type 1","03","04","Fish fillets and other fish meat (whether or not minced); fresh, chilled or frozen","Filets de poisson et autre chair de poisson (même hachés) ; frais, réfrigéré ou surgelé"
"0305","Type 1","03","05","Fish; dried, salted or in brine, smoked fish, whether or not cooked before or during the smoking process, fish meal fit for human consumption","Poisson ; poissons séchés, salés ou en saumure, fumés, même cuits avant ou pendant le fumage, farines de poisson propres à l'alimentation humaine"
"0306","Type 1","03","06","Crustaceans, in shell or not, live, fresh, chilled, frozen, dried, salted or in brine; crustaceans, in shell, cooked by steaming or boiling in water, chilled or not, frozen, dried, salted or in brine","Crustacés, décortiqués ou non, vivants, frais, réfrigérés, congelés, séchés, salés ou en saumure  ; crustacés, en carapace, cuits à la vapeur ou bouillis dans l'eau, réfrigérés ou non, congelés, séchés, salés ou en saumure"
"0307","Type 1","03","07","Molluscs, whether in shell or not, live, fresh, chilled, frozen, dried, salted in brine; aquatic invertebrates (not crustaceans and molluscs) live, fresh, chilled, frozen, dried, salted or in brine","Mollusques, même décortiqués, vivants, frais, réfrigérés, congelés, séchés, salés en saumure  ; invertébrés aquatiques (à l'exception des crustacés et des mollusques) vivants, frais, réfrigérés, congelés, séchés, salés ou en saumure"
"0401","Type 1","04","01","Milk and cream; not concentrated nor containing added sugar or other sweetening matter","Lait et crème ; non concentré ni additionné de sucre ou d'autres édulcorants"
"0402","Type 1","04","02","Milk and cream; concentrated or containing added sugar or other sweetening matter","Lait et crème ; concentré ou additionné de sucre ou d'autres édulcorants"
"0403","Type 1","04","03","Buttermilk, curdled milk and cream, yoghurt, kephir, fermented or acidified milk or cream, whether or not concentrated, containing added sugar, sweetening matter, flavoured or added fruit or cocoa","Babeurre, lait et crème caillés, yaourt, képhir, lait ou crème fermentés ou acidifiés, même concentrés, additionnés de sucre, d'édulcorants, de fruits aromatisés ou ajoutés ou de cacao"
"0404","Type 1","04","04","Whey and products consisting of natural milk constituents; whether or not containing added sugar or other sweetening matter, not elsewhere specified or included","Lactosérum et produits à base de constituants naturels du lait ; avec ou sans addition de sucre ou d'autres édulcorants, non dénommés ni compris ailleurs"
"0405","Type 1","04","05","Butter and other fats and oils derived from milk","Beurre et autres graisses et huiles dérivées du lait"
"0406","Type 1","04","06","Cheese and curd","Fromage et caillé"
"0407","Type 1","04","07","Birds' eggs, in shell; fresh, preserved or cooked","Oeufs d'oiseaux, en coquille ; frais, en conserve ou cuit"
"0408","Type 1","04","08","Birds' eggs, not in shell; egg yolks, fresh, dried, cooked by steaming or boiling in water, moulded, frozen or otherwise preserved, whether or not containing added sugar or other sweetening matter","Oeufs d'oiseaux, non en coquille ; jaunes d'oeufs, frais, séchés, cuits à la vapeur ou bouillis dans l'eau, moulés, congelés ou autrement conservés, avec ou sans addition de sucre ou d'autres édulcorants"
"0409","Type 1","04","09","Honey; natural","Chéri ; Naturel"
"0410","Type 1","04","10","Edible products of animal origin; not elsewhere specified or included","Produits comestibles d'origine animale ; non dénommés ni compris ailleurs"
"0501","Type 1","05","01","Human hair; unworked, whether or not washed or scoured; waste of human hair","Cheveux humains ; bruts, même lavés ou décapés ; perte de cheveux humains"
"0502","Type 1","05","02","Pigs', hogs' or boars' bristles and hair; and waste thereof","Soies et poils de porc, de porc ou de sanglier ; et leurs déchets"
"0503","Type 1","05","03","Horsehair and horsehair waste; whether or not put up as a layer with or without supporting material","Crin et déchets de crin ; même posé en couche avec ou sans support"
"0504","Type 1","05","04","Guts, bladders and stomachs of animals (other than fish); whole and pieces thereof","Boyaux, vessies et estomacs d'animaux (autres que les poissons) ; entiers et en morceaux"
"0505","Type 1","05","05","Skins and other parts of birds with feathers, down; feathers, down and parts thereof; not further worked than cleaned, disinfected, treated for preservation; powder, waste and parts of feathers","Peaux et autres parties d'oiseaux avec plumes, duvet ; plumes, duvet et leurs parties ; pas plus travaillé que nettoyé, désinfecté, traité pour la conservation ; poudre, déchets et parties de plumes"
"0506","Type 1","05","06","Bones and horn-cores, unworked, defatted, simply prepared (but not cut to shape), treated with acid or degelatinised; powder and waste of these products","Os et cornillons, bruts, dégraissés, simplement préparés (mais non découpés en forme), acidulés ou dégélatinés ; poudre et déchets de ces produits"
"0507","Type 1","05","07","Ivory, tortoise-shell, whalebone and whalebone hair, horns, antlers, hooves, nails, claws and beaks unworked or simply prepared, not cut to shape; waste and powder of these products","Ivoire, écaille de tortue, baleine et poils d'os de baleine, cornes, bois, sabots, ongles, griffes et becs bruts ou simplement préparés, non découpés en forme ; déchets et poudre de ces produits"
"0508","Type 1","05","08","Coral and similar materials, unworked or simply prepared, shells of molluscs, crustaceans or echinoderms and cuttle-bone, not cut to shape powder and waste thereof","Corail et matières similaires, bruts ou simplement préparés, coquilles de mollusques, crustacés ou échinodermes et os de seiche, non découpés en poudre et leurs déchets"
"0509","Type 1","05","09","Sponges, natural;  of animal origin","Éponges naturelles ; d'origine animale"
"0510","Type 1","05","10","Ambergris, castoreum, civet and musk; cantharides; bile, dried or not glands, other animal products used in preparation of pharmaceutical products, fresh chilled, frozen or otherwise provisionally preserved","Ambre gris, castoreum, civette et musc ; cantharides ; bile, glandes séchées ou non, autres produits d'origine animale utilisés dans la préparation de produits pharmaceutiques, frais réfrigérés, congelés ou autrement conservés provisoirement"
"0511","Type 1","05","11","Animal products not elsewhere specified or included; dead animals of chapter 1 or 3, unfit for human consumption","Produits d'origine animale non dénommés ni compris ailleurs ; animaux morts du chapitre 1 ou 3, impropres à la consommation humaine"
"0601","Type 2","06","01","Bulbs, tubers, tuberous roots, corms, crowns and rhizomes; dormant, in growth or in flower; chicory plants and roots other than roots of heading no. 1212","Bulbes, tubercules, racines tubéreuses, bulbes, couronnes et rhizomes ; dormant, en croissance ou en fleur ; plantes et racines de chicorée autres que les racines du no. 1212"
"0602","Type 2","06","02","Plants, live; n.e.s. in heading no. 0601, (including their roots) cuttings and slips; mushroom spawn","Plantes vivantes  ; n.c.a. dans la rubrique no. 0601, (y compris leurs racines) boutures et greffons ; blanc de champignon"
"0603","Type 2","06","03","Flowers; cut flowers and flower buds of a kind suitable for bouquets or for ornamental purposes, fresh, dried, dyed, bleached, impregnated or otherwise prepared","Fleurs ; fleurs coupées et boutons de fleurs pour bouquets ou pour ornements, frais, séchés, teints, blanchis, imprégnés ou autrement préparés"
"0604","Type 2","06","04","Foliage, branches and other parts of plants, without flowers or flower buds, and grasses, mosses and lichens; suitable for bouquets or for ornamental purposes, fresh, dried, dyed, bleached, impregnated etc.","Feuillage, branches et autres parties de plantes, sans fleurs ni boutons floraux, et herbes, mousses et lichens ; convient aux bouquets ou à des fins ornementales, frais, séché, teint, blanchi, imprégné, etc."
"0701","Type 2","07","01","Potatoes; fresh or chilled","Pommes de terre ; frais ou réfrigéré"
"0702","Type 2","07","02","Tomatoes; fresh or chilled","Tomates ; frais ou réfrigéré"
"0703","Type 2","07","03","Onions, shallots, garlic, leeks and other alliaceous vegetables; fresh or chilled","Oignons, échalotes, ail, poireaux et autres légumes alliacés  ; frais ou réfrigéré"
"0704","Type 2","07","04","Cabbages, cauliflowers, kohlrabi, kale and similar edible brassicas; fresh or chilled","Choux, choux-fleurs, chou-rave, chou frisé et crucifères comestibles similaires  ; frais ou réfrigéré"
"0705","Type 2","07","05","Lettuce (lactuca sativa) and chicory (cichorium spp.) fresh or chilled","Laitue (lactuca sativa) et chicorée (cichorium spp.) fraîches ou réfrigérées"
"0706","Type 2","07","06","Carrots, turnips, salad beetroot, salsify, celeriac, radishes and similar edible roots; fresh or chilled","Carottes, navets, betteraves à salade, salsifis, céleri-rave, radis et racines comestibles similaires  ; frais ou réfrigéré"
"0707","Type 2","07","07","Cucumbers and gherkins; fresh or chilled","Concombres et cornichons ; frais ou réfrigéré"
"0708","Type 2","07","08","Leguminous vegetables; shelled or unshelled, fresh or chilled","Légumes à cosse ; décortiqué ou non, frais ou réfrigéré"
"0709","Type 2","07","09","Vegetables, n.e.s. in chapter 07; fresh or chilled","Légumes, n.d.a. au chapitre 07 ; frais ou réfrigéré"
"0710","Type 2","07","10","Vegetables (uncooked or cooked by steaming or boiling in water); frozen","Légumes (non cuits ou cuits à la vapeur ou bouillis dans l'eau) ; gelé"
"0711","Type 2","07","11","Vegetables provisionally preserved; (eg by sulphur dioxide gas, in brine, in sulphur water or in other preservative solutions), but unsuitable in that state for immediate consumption","Légumes conservés provisoirement  ; (par exemple par du dioxyde de soufre gazeux, dans de la saumure, dans de l'eau sulfureuse ou dans d'autres solutions de conservation), mais impropre dans cet état à la consommation immédiate"
"0712","Type 2","07","12","Vegetables, dried; whole, cut, sliced, broken or in powder, but not further prepared","Légumes séchés ; entiers, coupés, tranchés, brisés ou en poudre, mais non autrement préparés"
"0713","Type 2","07","13","Vegetables, dried leguminous; shelled, whether or not skinned or split","Légumes, légumineuses séchées  ; décortiqués, même décortiqués ou fendus"
"0714","Type 2","07","14","Manioc, arrowroot, salep, Jerusalem artichokes, sweet potatoes and similar roots and tubers with high starch or inulin content; fresh or dried, whether or not sliced or in the form of pellets; sago pith","Manioc, arrow-root, salep, topinambours, patates douces et racines et tubercules similaires à haute teneur en amidon ou en inuline ; frais ou séchés, même tranchés ou sous forme de pellets ; moelle de sagou"
"0801","Type 2","08","01","Nuts, edible; coconuts, Brazil nuts and cashew nuts, fresh or dried, whether or not shelled or peeled","Noix comestibles ; noix de coco, noix du Brésil et noix de cajou, fraîches ou séchées, même décortiquées ou décortiquées"
"0802","Type 2","08","02","Nuts (excluding coconuts, Brazils and cashew nuts); fresh or dried, whether or not shelled or peeled","Noix (à l'exclusion des noix de coco, du Brésil et des noix de cajou) ; frais ou séchés, même décortiqués ou décortiqués"
"0803","Type 2","08","03","Bananas, including plantains; fresh or dried","Bananes, y compris plantains  ; frais ou séché"
"0804","Type 2","08","04","Dates, figs, pineapples, avocados, guavas, mangoes and mangosteens; fresh or dried","Dattes, figues, ananas, avocats, goyaves, mangues et mangoustans  ; frais ou séché"
"0805","Type 2","08","05","Citrus fruit; fresh or dried","Agrumes ; frais ou séché"
"0806","Type 2","08","06","Grapes; fresh or dried","Raisins ; frais ou séché"
"0807","Type 2","08","07","Melons (including watermelons) and papaws (papayas); fresh","Melons (y compris pastèques) et papayes (papayes) ; Frais"
"0808","Type 2","08","08","Apples, pears and quinces; fresh","Pommes, poires et coings ; Frais"
"0809","Type 2","08","09","Apricots, cherries, peaches (including nectarines), plums and sloes, fresh","Abricots, cerises, pêches (y compris les nectarines), prunes et prunelles, frais"
"0810","Type 2","08","10","Fruit, fresh; n.e.s. in chapter 8","Fruits frais ; n.c.a. au chapitre 8"
"0811","Type 2","08","11","Fruit and nuts; uncooked or cooked by steaming or boiling in water, frozen, whether or not containing added sugar or other sweetening matter","Fruits et noix ; non cuits ou cuits à la vapeur ou bouillis dans l'eau, congelés, avec ou sans addition de sucre ou d'autres édulcorants"
"0812","Type 2","08","12","Fruit and nuts provisionally preserved; (eg by sulphur dioxide gas, brine, in sulphur water or in other preservative solutions), but unsuitable in that state for immediate consumption","Fruits et noix conservés provisoirement  ; (par exemple par du dioxyde de soufre gazeux, de la saumure, dans de l'eau sulfureuse ou dans d'autres solutions de conservation), mais impropre dans cet état à la consommation immédiate"
"0813","Type 2","08","13","Fruit, dried, other than that of heading no. 0801 to 0806; mixtures of nuts or dried fruits of this chapter","Fruits séchés autres que ceux du no. 0801 à 0806  ; mélanges de fruits à coque ou de fruits secs du présent chapitre"
"0814","Type 2","08","14","Peel of citrus fruit or melons (including watermelons); fresh, frozen dried or provisionally preserved in brine, in sulphur water or in other preservative solutions","Écorces d'agrumes ou de melons (y compris les pastèques) ; frais, congelé, séché ou conservé provisoirement dans une saumure, dans de l'eau sulfurée ou dans d'autres solutions de conservation"
"0901","Type 2","09","01","Coffee, whether or not roasted or decaffeinated; husks and skins; coffee substitutes containing coffee in any proportion","Café, même torréfié ou décaféiné ; coques et peaux ; succédanés de café contenant du café en toute proportion"
"0902","Type 2","09","02","Tea","Thé"
"0903","Type 2","09","03","Mate","Camarade"
"0904","Type 2","09","04","Pepper of the genus piper; dried or crushed or ground fruits of the genus capsicum or of the genus pimenta","Poivre du genre piper ; fruits séchés ou broyés ou broyés du genre capsicum ou du genre pimenta"
"0905","Type 2","09","05","Vanilla","Vanille"
"0906","Type 2","09","06","Cinnamon and cinnamon-tree flowers","Cannelle et fleurs de cannelier"
"0907","Type 2","09","07","Cloves; (whole fruit, cloves and stems)","Clous de girofle ; (fruits entiers, clous de girofle et tiges)"
"0908","Type 2","09","08","Nutmeg, mace and cardamoms","Noix de muscade, macis et cardamomes"
"0909","Type 2","09","09","Seeds of anise, badian, fennel, coriander, cumin, caraway or juniper","Graines d'anis, de badiane, de fenouil, de coriandre, de cumin, de carvi ou de genévrier"
"0910","Type 2","09","10","Ginger, saffron, tumeric (curcuma), thyme, bay leaves, curry and other spices","Gingembre, safran, curcuma (curcuma), thym, laurier, curry et autres épices"
"1001","Type 2","10","01","Wheat and meslin","Blé et méteil"
"1002","Type 2","10","02","Rye","Seigle"
"1003","Type 2","10","03","Barley","Orge"
"1004","Type 2","10","04","Oats","Avoine"
"1005","Type 2","10","05","Maize (corn)","Maïs (maïs)"
"1006","Type 2","10","06","Rice","Riz"
"1007","Type 2","10","07","Grain sorghum","Sorgho grain"
"1008","Type 2","10","08","Buckwheat, millet and canary seed; other cereals","Sarrasin, millet et alpiste ; autres céréales"
"1101","Type 2","11","01","Wheat or meslin flour","Farine de blé ou de méteil"
"1102","Type 2","11","02","Cereal flours; other than of wheat or meslin","Farines de céréales ; autres que de froment ou de méteil"
"1103","Type 2","11","03","Cereal groats; meal and pellets","Gruaux de céréales ; farine et granulés"
"1104","Type 2","11","04","Cereal grains otherwise worked (eg hulled, rolled, flaked, pearled, sliced or kibbled) except rice of heading no. 1006; germ of cereals whole, rolled, flaked or ground","Grains de céréales autrement travaillés (par exemple, décortiqués, aplatis, en flocons, perlés, tranchés ou concassés) à l'exception du riz du no. 1006  ; germe de céréales entier, roulé, en flocons ou moulu"
"1105","Type 2","11","05","Flour, meal, and flakes of potatoes","Farine, semoule et flocons de pommes de terre"
"1106","Type 2","11","06","Flour and meal; of the dried leguminous vegetables of heading no. 0713, of sago or of roots or tubers of heading no. 0714; flour, meal and powder of the products of chapter 8","Farine et semoule  ; des légumes à cosse secs du no. 0713, de sagou ou de racines ou tubercules du no. 0714  ; farine, semoule et poudre des produits du chapitre 8"
"1107","Type 2","11","07","Malt; whether or not roasted","Malt ; torréfié ou non"
"1108","Type 2","11","08","Starches; inulin","Amidons ; inuline"
"1109","Type 2","11","09","Wheat gluten; whether or not dried","Gluten de blé ; séché ou non"
"1201","Type 2","12","01","Soya beans; whether or not broken","Les graines de soja ; cassé ou non"
"1202","Type 2","12","02","Ground-nuts; not roasted or otherwise cooked, whether or not shelled or broken","Arachides ; non rôtis ni autrement cuits, même décortiqués ou brisés"
"1203","Type 2","12","03","Copra","Copra"
"1204","Type 2","12","04","Oil seeds; linseed, whether or not broken","Graines oléagineuses ; graines de lin, même concassées"
"1205","Type 2","12","05","Rape or colza seeds; whether or not broken","Graines de navette ou de colza ; cassé ou non"
"1206","Type 2","12","06","Sunflower seeds; whether or not broken","Graines de tournesol ; cassé ou non"
"1207","Type 2","12","07","Oil seeds and oleaginous fruits, others n.e.s. in chapter 12; whether or not broken","Graines et fruits oléagineux, autres n.d.a. au chapitre 12 ; cassé ou non"
"1208","Type 2","12","08","Flours and meals of oil seeds or oleaginous fruits; other than those of mustard","Farines et semoules de graines ou de fruits oléagineux ; autres que ceux de la moutarde"
"1209","Type 2","12","09","Seeds, fruit and spores; of a kind used for sowing","Graines, fruits et spores ; du type utilisé pour l'ensemencement"
"1210","Type 2","12","10","Hop cones, fresh or dried, whether or not ground, powdered or in the form of pellets; lupulin","Cônes de houblon, frais ou séchés, même broyés, moulus ou sous forme de pellets ; lupuline"
"1211","Type 2","12","11","Plants and parts of plants (including seeds and fruits), used primarily in perfumery, pharmacy; for insecticidal, fungicidal or similar purposes, fresh or dried, whether or not crushed or powdered","Plantes et parties de plantes (y compris graines et fruits), utilisées principalement en parfumerie, pharmacie ; à usage insecticide, fongicide ou similaire, frais ou séchés, même broyés ou réduits en poudre"
"1212","Type 2","12","12","Locust beans, seaweeds and other algae, sugar beet, sugar cane; fresh, dried, whether or not ground; fruit stones, kernels and other vegetable products (including unroasted chicory roots) used primarily for human consumption, n.e.s.","Caroubes, algues et autres algues, betterave sucrière, canne à sucre ; frais, séchés, même moulus ; noyaux de fruits, amandes et autres produits végétaux (y compris les racines de chicorée non torréfiées) utilisés principalement pour l'alimentation humaine, n.d.a."
"1213","Type 2","12","13","Cereal straw and husks, unprepared; whether or not chopped, ground, pressed or in the form of pellets","Paille et balles de céréales, non préparées ; même haché, broyé, pressé ou sous forme de pellets"
"1214","Type 2","12","14","Swedes, mangolds, fodder roots, hay, lucerne (alfalfa), clover, sainfoin, forage kale, lupines, vetches and similar forage products, whether or not in the form of pellets","Rutabagas, mangolds, racines fourragères, foin, luzerne, trèfle, sainfoin, choux fourragers, lupins, vesces et produits fourragers similaires, même sous forme de pellets"
"1301","Type 2","13","01","Lac; natural gums, resins, gum-resins and balsams","Lac ; gommes, résines, gommes-résines et baumes naturels"
"1302","Type 2","13","02","Vegetable saps and extracts; pectic substances, pectinates and pectates; agar-agar and other mucilages and thickeners, whether or not modified, derived from vegetable products","Sucs et extraits végétaux ; matières pectiques, pectinates et pectates ; agar-agar et autres mucilages et épaississants dérivés de végétaux, même modifiés"
"1401","Type 2","14","01","Vegetable materials of a kind used primarily for plaiting; (eg bamboos, rattans, reeds, rushes, osier, raffia, cleaned, bleached or dyed cereal straw and lime bark)","Matières végétales des types utilisés principalement pour la tressage ; (par exemple bambous, rotins, roseaux, joncs, osier, raphia, paille de céréales nettoyée, blanchie ou teinte et écorce de tilleul)"
"1402","Type 2","14","02","Vegetable materials of a kind used primarily as stuffing or as padding; (eg kapok, vegetable hair and eel grass), whether or not put up as a layer with or without supporting material","Matières végétales des types utilisés principalement comme farce ou comme rembourrage ; (par exemple, kapok, poils végétaux et zostère), même présentés en couche avec ou sans support"
"1403","Type 2","14","03","Vegetable materials of a kind used primarily in brooms or brushes; (eg broomcorn, piassava, couch-grass and istle), whether or not in hanks or bundles","Matières végétales des types utilisés principalement dans les balais ou les brosses  ; (p.ex. genêt à balai, piassava, chiendent et istle), même en écheveaux ou en bottes"
"1404","Type 2","14","04","Vegetable products not elsewhere specified or included","Produits végétaux non dénommés ni compris ailleurs"
"1501","Type 3","15","01","Lard; other pig fat and poultry fat, rendered, whether or not pressed or solvent-extracted","Saindoux ; autres graisses de porc et graisses de volaille, fondues, même pressées ou extraites au solvant"
"1502","Type 3","15","02","Fats of bovine animals, sheep or goats; raw or rendered, whether or not pressed or solvent-extracted","Graisses de bovins, ovins ou caprins ; bruts ou fondus, même pressés ou extraits au solvant"
