"Code 4-digit","Section Code","Part 2-digit","Part 4-digit","Product Name","Nom du produit"
"5601","Type 11","56","01","Wadding of textile materials and articles thereof; textile fibres, not exceeding 5 mm in length (flock), textile dust and mill neps","Ouates de matières textiles et ouvrages en ces matières ; fibres textiles d'une longueur n'excédant pas 5 mm (flock), poussières textiles et neps de moulin"
"5602","Type 11","56","02","Felt; whether or not impregnated, coated, covered or laminated","Feutre ; même imprégnés, enduits, recouverts ou stratifiés"
"5603","Type 11","56","03","Nonwovens; whether or not impregnated, coated, covered or laminated","Non-tissés  ; même imprégnés, enduits, recouverts ou stratifiés"
"5604","Type 11","56","04","Rubber thread and cord, textile covered; textile yarn and strip and the like of heading no. 5404, 5405; impregnated, coated, covered or sheathed with rubber or plastics","Fils et cordons en caoutchouc, recouverts de textile ; fils et lames textiles et simil. du n°5404, 5405  ; imprégnés, enduits, recouverts ou gainés de caoutchouc ou de plastique"
"5605","Type 11","56","05","Yarn; metallised, whether or not gimped, of textile yarn, or strip or the like of heading no. 5404 or 5405, combined with metal in the form of thread, strip or powder or covered with metal","Fil ; métallisés, même guipés, de fils textiles, de lames ou de formes similaires du no. 5404 ou 5405, combinés avec du métal sous forme de fil, de bande ou de poudre ou recouverts de métal"
"5606","Type 11","56","06","Yarn and strip and the like of heading no. 5404 or 5405, gimped (other than those of heading no. 5606 and gimped horsehair yarn); chenille yarn (including flock chenille yarn); loop wale-yarn","Fils et bandes et similaires du n°5404 ou 5405, guipés (autres que ceux du n°5606 et fils de crin guipés) ; fils de chenille (y compris fils de chenille floqués) ; boucle de fil de baleine"
"5607","Type 11","56","07","Twine, cordage, ropes and cables, whether or not plaited or braided; whether or not impregnated, coated, covered or sheathed with rubber or plastics","Ficelles, cordages, cordes et câbles, même tressés ou tressés ; même imprégnés, enduits, recouverts ou gainés de caoutchouc ou de matière plastique"
"5608","Type 11","56","08","Twine, cordage or rope; knotted netting, made up fishing nets and other made up nets, of textile materials","Ficelle, cordage ou corde ; filets noués, filets de pêche confectionnés et autres filets confectionnés, en matières textiles"
"5609","Type 11","56","09","Articles of yarn, strip or the like of heading no. 5404 or 5405; twine, cordage, rope or cables n.e.s. or included","Ouvrages en fils, lames ou formes similaires du no. 5404 ou 5405  ; ficelles, cordages, cordes ou câbles n.d.a. ou inclus"
"5701","Type 11","57","01","Carpets and other textile floor coverings; knotted, whether or not made up","Tapis et autres revêtements de sol textiles ; noués, confectionnés ou non"
"5702","Type 11","57","02","Carpets and other textile floor coverings; woven, (not tufted or flocked), whether or not made up, including ""kelem"", ""schumacks"", ""karamanie"" and similar hand-woven rugs","Tapis et autres revêtements de sol textiles ; tissés (non touffetés ni floqués), même confectionnés, y compris les kelem, schumacks, karamanie et tapis similaires tissés à la main"
"5703","Type 11","57","03","Carpets and other textile floor coverings; tufted, whether or not made up","Tapis et autres revêtements de sol textiles ; touffeté, même confectionné"
"5704","Type 11","57","04","Carpets and other textile floor coverings; of felt, (not tufted or flocked), whether or not made up","Tapis et autres revêtements de sol textiles ; de feutre (non touffeté ni floqué), même confectionné"
"5705","Type 11","57","05","Carpets and other textile floor coverings; n.e.s. in chapter 57, whether or not made up","Tapis et autres revêtements de sol textiles ; n.c.a. au chapitre 57, qu'ils soient ou non constitués"
"5801","Type 11","58","01","Fabrics; woven pile and chenille fabrics, other than fabrics of heading no. 5802 or 5806","Tissus ; tissus velours et chenille tissés, autres que les tissus du no. 5802 ou 5806"
"5802","Type 11","58","02","Fabrics; terry towelling and similar woven terry fabrics other than narrow fabrics of heading no. 5806; tufted textile fabrics, excluding products of heading no. 5703","Tissus ; éponge en tissu éponge et tissus similaires en tissu éponge autres que les tissus fins du no. 5806  ; tissus tuftés, à l'exclusion des produits du no. 5703"
"5803","Type 11","58","03","Gauze; other than narrow fabrics of heading no. 5806","Gaze ; autres que les tissus fins du no. 5806"
"5804","Type 11","58","04","Tulles and other net fabrics; not including woven, knitted or crocheted fabrics; lace in the piece, in strips or in motifs, (other than fabrics of heading no. 6002)","Tulles et autres tissus filets ; à l'exclusion des tissus tissés, tricotés ou crochetés ; dentelles en pièces, en bandes ou en motifs (autres que les tissus du n°6002)"
"5805","Type 11","58","05","Tapestries; hand-woven, (gobelins, flanders, aubusson, beauvais and the like) and needle-worked tapestries (eg petit point, cross-stitch) whether or not made up","Tapisseries ; tapisseries tissées à la main (gobelins, flandres, aubusson, beauvais et similaires) et à l'aiguille (p.ex. petit point, point de croix) même confectionnées"
"5806","Type 11","58","06","Fabrics; narrow woven, other than goods of heading no. 5807; narrow fabrics consisting of warp without weft assembled by means of an adhesive (bolducs)","Tissus ; à tissage étroit, autres que les produits du no. 5807  ; tissus étroits constitués de chaîne sans trame assemblés au moyen d'un adhésif (bolducs)"
"5807","Type 11","58","07","Labels, badges and similar articles; of textile materials, in the piece, in strips or cut to shape or size, not embroidered","Étiquettes, insignes et articles similaires  ; de matières textiles, en pièces, en bandes ou découpées à façon, non brodées"
"5808","Type 11","58","08","Braids in the piece; ornamental trimmings in the piece, without embroidery, other than knitted or crocheted; tassels, pompons and similar articles","Tresses dans la pièce ; passementerie en pièce, sans broderie, autre qu'en bonneterie ; glands, pompons et articles similaires"
"5809","Type 11","58","09","Fabrics, woven; of metal thread and metallised yarn of heading no. 5605, of a kind used in apparel, as furnishing fabrics or similar purposes; n.e.s. or included","Tissus tissés ; de fils métalliques et de fils métallisés du n°5605, des types utilisés pour l'habillement, comme tissus d'ameublement ou à des fins similaires  ; n.c.a. ou inclus"
"5810","Type 11","58","10","Embroidery; in the piece, in strips or in motifs","Broderie ; à la pièce, en bandes ou en motifs"
"5811","Type 11","58","11","Quilted textile products; in the piece, composed of one or more layers of textile materials assembled with padding by stitching or otherwise (excluding embroidery of heading no. 5810)","Produits textiles matelassés ; en pièce, composés d'une ou plusieurs couches de matières textiles assemblées avec rembourrage par couture ou autrement (à l'exclusion des broderies du n°5810)"
"5901","Type 11","59","01","Textile fabrics, gum or amylaceous substance coated, used for outer book covers and like; tracing cloth, prepared painting canvas; buckram and similar stiffened textile fabrics used for hat foundation","Tissus textiles, enduits de gomme ou de substance amylacée, utilisés pour les couvertures extérieures de livres et similaires ; toile à tracer, toile à peindre préparée ; bougran et tissus textiles raidis similaires utilisés pour la fondation des chapeaux"
"5902","Type 11","59","02","Textile fabrics; tyrecord of high tenacity yarn of nylon or other polyamides polyesters or viscose rayon","Tissus textiles ; tyrecord de fils à haute ténacité de nylon ou d'autres polyamides polyesters ou rayonne viscose"
"5903","Type 11","59","03","Textile fabrics impregnated, coated, covered or laminated with plastics, other than those of heading no. 5902","Tissus imprégnés, enduits, recouverts ou stratifiés de matières plastiques, autres que ceux du no. 5902"
"5904","Type 11","59","04","Linoleum, whether or not cut to shape; floor coverings consisting of a coating or covering applied on a textile backing, whether or not cut to shape","Linoléum, même découpé en forme ; revêtements de sol constitués d'un enduit ou d'un revêtement appliqué sur un support textile, même découpés en forme"
"5905","Type 11","59","05","Textile wall coverings","Revêtements muraux textiles"
"5906","Type 11","59","06","Textile fabrics, rubberised; other than those of heading no. 5902","Tissus textiles caoutchoutés ; autres que ceux du no. 5902"
"5907","Type 11","59","07","Textile fabrics; otherwise impregnated, coated or covered; painted canvas being theatrical scenery, studio back-cloths or the like","Tissus textiles ; autrement imprégnés, enduits ou couverts  ; toiles peintes en tant que décors de théâtre, toiles de fond de studio ou similaires"
"5908","Type 11","59","08","Textile wicks, woven, plaited or knitted; for lamps, stoves, lighters, candles or the like; incandescent gas mantles and tubular knitted gas mantle fabric therefor, whether or not impregnated","Mèches textiles, tissées, tressées ou tricotées ; pour lampes, réchauds, briquets, bougies ou similaires  ; manchons à gaz incandescents et tissus tubulaires tricotés pour manchons à gaz, même imprégnés"
"5909","Type 11","59","09","Textile hosepiping and similar textile tubing; with or without lining, armour or accessories of other materials","Tuyaux textiles et tubes textiles similaires ; avec ou sans doublure, armure ou accessoires d'autres matériaux"
"5910","Type 11","59","10","Textiles; transmission or conveyor belts or belting, of textile material, whether or not reinforced with metal or other material","Textiles ; courroies ou bandes transporteuses ou de transmission, en matières textiles, même renforcées de métal ou d'une autre matière"
"5911","Type 11","59","11","Textile products and articles for technical uses; specified in note 7 to this chapter","Produits textiles et articles à usage technique ; spécifié dans la note 7 du présent chapitre"
"6001","Type 11","60","01","Fabrics; pile fabrics, including ""long pile"" fabrics and terry fabrics, knitted or crocheted","Tissus ; tissus à poils, y compris tissus à poils longs et tissus éponge, tricotés ou crochetés"
"6002","Type 11","60","02","Fabrics; knitted or crocheted, other than those of heading no. 6001","Tissus ; en bonneterie, autres que celles du n°6001"
"6101","Type 11","61","01","Coats; men's or boys' overcoats, car-coats, capes, cloaks, anoraks, ski-jackets, wind-cheaters, wind-jackets and similar articles; knitted or crocheted, other than those of heading no. 6103","Manteaux ; pardessus, cabans, capes, capes, anoraks, vestes de ski, coupe-vent, coupe-vent et articles similaires pour hommes ou garçonnets ; en bonneterie, autres que celles du n°6103"
"6102","Type 11","61","02","Coats; women's or girls' overcoats, car-coats, capes, cloaks, anoraks, ski-jackets, wind-cheaters, wind-jackets and similar articles, knitted or crocheted, other than those of heading no. 6104","Manteaux ; pardessus, paletots, capes, capes, anoraks, vestes de ski, coupe-vent, coupe-vent et articles similaires, en bonneterie, pour femmes ou fillettes, autres que ceux du no. 6104"
"6103","Type 11","61","03","Suits, ensembles, jackets, blazers, trousers, bib and brace overalls, breeches, shorts (not swimwear); men's or boys', knitted or crocheted","Costumes, ensembles, vestes, blazers, pantalons, salopettes à bretelles, culottes, shorts (à l'exception des maillots de bain) ; pour hommes ou garçons, tricotés ou crochetés"
"6104","Type 11","61","04","Suits, ensembles, jackets, dresses, skirts, divided skirts, trousers, bib and brace overalls, breeches and shorts (not swimwear), women's or girls', knitted or crocheted","Costumes, ensembles, vestes, robes, jupes, jupes-culottes, pantalons, salopettes à bretelles, culottes et shorts (à l'exception des maillots de bain), pour femmes ou fillettes, en bonneterie"
"6105","Type 11","61","05","Shirts; men's or boys', knitted or crocheted","Chemises ; pour hommes ou garçons, tricotés ou crochetés"
"6106","Type 11","61","06","Blouses, shirts and shirt-blouses; women's or girls', knitted or crocheted","Blouses, chemises et chemisiers chemises ; pour femmes ou filles, tricotés ou crochetés"
"6107","Type 11","61","07","Underpants, briefs, nightshirts, pyjamas, bathrobes, dressing gowns and similar articles; men's or boys', knitted or crocheted","Caleçons, slips, chemises de nuit, pyjamas, peignoirs, robes de chambre et articles similaires  ; pour hommes ou garçons, tricotés ou crochetés"
"6108","Type 11","61","08","Slips, petticoats, briefs, panties, nightdresses, pyjamas, negligees, bathrobes, dressing gowns and similar articles; women's or girls', knitted or crocheted","Slips, jupons, caleçons, culottes, chemises de nuit, pyjamas, déshabillés, peignoirs, robes de chambre et articles similaires  ; pour femmes ou filles, tricotés ou crochetés"
"6109","Type 11","61","09","T-shirts, singlets and other vests; knitted or crocheted","T-shirts, maillots et autres gilets ; tricoté ou crocheté"
"6110","Type 11","61","10","Jerseys, pullovers, cardigans, waistcoats and similar articles; knitted or crocheted","Jerseys, pull-overs, cardigans, gilets et articles similaires  ; tricoté ou crocheté"
"6111","Type 11","61","11","Garments and clothing accessories, babies'; knitted or crocheted","Vêtements et accessoires vestimentaires pour bébés » ; tricoté ou crocheté"
"6112","Type 11","61","12","Track suits, ski suits and swimwear; knitted or crocheted","Survêtements, combinaisons de ski et maillots de bain ; tricoté ou crocheté"
"6113","Type 11","61","13","Garments made up of knitted or crocheted fabrics of heading no. 5903, 5906 and 5907","Vêtements en étoffes de bonneterie du no. 5903, 5906 et 5907"
"6114","Type 11","61","14","Garments; knitted or crocheted, n.e.s. in chapter 61","Habits ; tricotés ou crochetés, n.d.a. au chapitre 61"
"6115","Type 11","61","15","Hosiery; panty hose, tights, stockings, socks and other hosiery, including stockings for varicose veins and footwear without applied soles, knitted or crocheted","Bonneterie ; collants, collants, bas, chaussettes et autres articles de bonneterie, y compris bas pour varices et chaussures sans semelles appliquées, tricotés ou crochetés"
"6116","Type 11","61","16","Gloves, mittens and mitts; knitted or crocheted","Gants, mitaines et mitaines ; tricoté ou crocheté"
"6117","Type 11","61","17","Clothing accessories; made up, knitted or crocheted, knitted or crocheted parts of garments or of clothing accessories","Vêtements & Accessoires ; confectionnés, tricotés ou crochetés, parties de vêtements ou d'accessoires vestimentaires en bonneterie"
"6201","Type 11","62","01","Overcoats, car-coats, capes, cloaks, anoraks (including ski-jackets), wind-cheaters, wind-jackets and similar articles, men's or boys', other than those of heading no. 6203 (not knitted or crocheted)","Pardessus, paletots, capes, capes, anoraks (y compris les vestes de ski), coupe-vent, coupe-vent et articles simil., pour hommes ou garçonnets, autres que ceux du no. 6203 (ni tricoté ni crocheté)"
"6202","Type 11","62","02","Coats; women's or girls' overcoats, carcoats, capes, cloaks, anoraks, ski-jackets, wind-cheaters, wind-jackets and similar articles, other than those of heading no. 6204 (not knitted or crocheted)","Manteaux ; pardessus, manteaux, capes, capes, anoraks, vestes de ski, coupe-vent, coupe-vent et articles simil., pour femmes ou fillettes, autres que ceux du no. 6204 (ni tricoté ni crocheté)"
"6203","Type 11","62","03","Suits, ensembles, jackets, blazers, trousers, bib and brace overalls, breeches and shorts (other than swimwear); men's or boys' (not knitted or crocheted)","Costumes, ensembles, vestes, blazers, pantalons, salopettes à bretelles, culottes et shorts (autres que maillots de bain) ; pour hommes ou garçons (ni tricotés ni crochetés)"
"6204","Type 11","62","04","Suits, ensembles, jackets, dresses, skirts, divided skirts, trousers, bib and brace overalls, breeches and shorts (other than swimwear); women's or girls' (not knitted or crocheted)","Costumes, ensembles, vestes, robes, jupes, jupes-culottes, pantalons, salopettes à bretelles, culottes et shorts (autres que maillots de bain) ; femmes ou filles (non tricotées ni crochetées)"
"6205","Type 11","62","05","Shirts; men's or boys' (not knitted or crocheted)","Chemises ; pour hommes ou garçons (ni tricotés ni crochetés)"
"6206","Type 11","62","06","Blouses, shirts and shirt-blouses; women's or girls' (not knitted or crocheted)","Blouses, chemises et chemisiers chemises ; femmes ou filles (non tricotées ni crochetées)"
"6207","Type 11","62","07","Singlets and other vests, underpants, briefs, night-shirts, pyjamas, bathrobes, dressing gowns and similar articles; men's or boys' (not knitted or crocheted)","Débardeurs et autres gilets, caleçons, caleçons, chemises de nuit, pyjamas, peignoirs, robes de chambre et articles similaires  ; pour hommes ou garçons (ni tricotés ni crochetés)"
"6208","Type 11","62","08","Singlets and other vests, slips, petticoats, briefs, panties, nightdresses, pyjamas, negligees, bathrobes, dressing gowns and similar articles; women's or girls' (not knitted or crocheted)","Débardeurs et autres gilets, slips, jupons, caleçons, culottes, chemises de nuit, pyjamas, déshabillés, peignoirs, robes de chambre et articles similaires  ; femmes ou filles (non tricotées ni crochetées)"
"6209","Type 11","62","09","Garments and clothing accessories; babies' (not knitted or crocheted)","Vêtements et accessoires vestimentaires ; bébés (ni tricotés ni crochetés)"
"6210","Type 11","62","10","Garments made up of fabrics of heading no. 5602, 5603, 5903, 5906 or 5907 (not knitted or crocheted)","Vêtements confectionnés en tissus du n°5602, 5603, 5903, 5906 ou 5907 (ni tricoté ni crocheté)"
"6211","Type 11","62","11","Track suits, swimwear and other garments (not knitted or crocheted)","Survêtements, maillots de bain et autres vêtements (non tricotés ni crochetés)"
"6212","Type 11","62","12","Brassieres, girdles, corsets, braces, suspenders, garters and similar articles and parts thereof; whether or not knitted or crocheted","Soutiens-gorge, gaines, corsets, bretelles, bretelles, jarretières et articles similaires et leurs parties ; même en bonneterie"
"6213","Type 11","62","13","Handkerchiefs (not knitted or crocheted)","Mouchoirs (ni tricotés ni crochetés)"
"6214","Type 11","62","14","Shawls, scarves, mufflers, mantillas, veils and the like (not knitted or crocheted)","Châles, écharpes, cache-nez, mantilles, voiles et articles similaires (autres qu'en bonneterie)"
"6215","Type 11","62","15","Ties, bow ties and cravats (not knitted or crocheted)","Cravates, noeuds papillons et cravates (non tricotés ni crochetés)"
"6216","Type 11","62","16","Gloves, mittens and mitts (not knitted or crocheted)","Gants, mitaines et mitaines (ni tricotés ni crochetés)"
"6217","Type 11","62","17","Clothing accessories n.e.s.; parts of garments or accessories other than those of heading no. 6212 (not knitted or crocheted)","Accessoires vestimentaires n.d.a.  ; parties de vêtements ou d'accessoires autres que celles du no. 6212 (ni tricoté ni crocheté)"
"6301","Type 11","63","01","Blankets and travelling rugs","Couvertures et tapis de voyage"
"6302","Type 11","63","02","Bed linen, table linen, toilet linen and kitchen linen","Linge de lit, linge de table, linge de toilette et linge de cuisine"
"6303","Type 11","63","03","Curtains (including drapes) and interior blinds; curtain or bed valances","Rideaux (y compris tentures) et stores intérieurs  ; rideaux ou cantonnières"
"6304","Type 11","63","04","Furnishing articles; excluding those of heading no. 9404","Articles d'ameublement ; à l'exclusion de ceux du no. 9404"
"6305","Type 11","63","05","Sacks and bags, of a kind used for the packing of goods","Sacs et sachets, des types utilisés pour l'emballage de marchandises"
"6306","Type 11","63","06","Tarpaulins, awnings and sunblinds, tents, sails for boats, sailboards or landcraft; camping goods","Bâches, auvents et stores, tentes, voiles pour bateaux, planches à voile ou chars à voile ; articles de camping"
"6307","Type 11","63","07","Textiles; made up articles n.e.s. in chapter 63, including dress patterns","Textiles ; articles confectionnés n.d.a. au chapitre 63, y compris les patrons de vêtements"
"6308","Type 11","63","08","Textiles; sets of woven fabric and yarn, with or without accessories, for making into rugs, tapestries, embroidered tablecloths, serviettes and similar textile articles, in packings for retail sale","Textiles ; ensembles de tissus et de fils tissés, avec ou sans accessoires, pour la confection de tapis, tapisseries, nappes brodées, serviettes et articles textiles similaires, en emballages pour la vente au détail"
"6309","Type 11","63","09","Textiles; worn clothing and other worn articles","Textiles ; vêtements usagés et autres articles usagés"
"6310","Type 11","63","10","Rags; used or new, scrap twine, cordage, rope and cables and worn out articles of twine, cordage, rope or cables, of textile materials","Chiffons ; usagés ou neufs, chutes de ficelles, cordages, cordes et câbles et articles usés en ficelles, cordages, cordes ou câbles, en matières textiles"
"6401","Type 12","64","01","Footwear; waterproof, with outer soles and uppers of rubber or plastics, (uppers not fixed to the sole nor assembled by stitch, rivet, nail, screw, plug or similar)","Chaussure ; imperméables, à semelles extérieures et dessus en caoutchouc ou en matière plastique (dessus non fixés à la semelle ni assemblés par couture, rivet, clou, vis, cheville ou similaire)"
"6402","Type 12","64","02","Footwear; with outer soles and uppers of rubber or plastics (excluding waterproof footwear)","Chaussure ; à semelles extérieures et dessus en caoutchouc ou en matière plastique (à l'exclusion des chaussures étanches)"
"6403","Type 12","64","03","Footwear; with outer soles of rubber, plastics, leather or composition leather and uppers of leather","Chaussure ; à semelles extérieures en caoutchouc, matière plastique, cuir naturel ou reconstitué et dessus en cuir"
"6404","Type 12","64","04","Footwear; with outer soles of rubber, plastics, leather or composition leather and uppers of textile materials","Chaussure ; à semelles extérieures en caoutchouc, matière plastique, cuir naturel ou cuir reconstitué et dessus en matières textiles"
"6405","Type 12","64","05","Footwear; other footwear n.e.s. in chapter 64","Chaussure ; autres chaussures n.c.a. au chapitre 64"
"6406","Type 12","64","06","Footwear; parts of footwear; removable in-soles, heel cushions and similar articles; gaiters, leggings and similar articles, and parts thereof","Chaussure ; parties de chaussures ; semelles intérieures amovibles, talonnettes et articles similaires amovibles ; guêtres, jambières et articles similaires, et leurs parties"
"6501","Type 12","65","01","Hat-forms, hat bodies and hoods of felt, neither blocked to shape nor with made brims; plateaux and manchons (including slit manchons) of felt","Formes de chapeaux, corps de chapeaux et capuchons en feutre, non moulés ni à bords façonnés ; plateaux et manchons (y compris les manchons à fente) en feutre"
"6502","Type 12","65","02","Hat-shapes; plaited or made by assembling strips of any material, neither blocked to shape, nor with made brims, nor lined, nor trimmed","Formes de chapeau  ; tressé ou réalisé par assemblage de bandes de toute matière, ni bloquées en forme, ni à bords confectionnés, ni doublées, ni parées"
"6503","Type 12","65","03","Hats and other felt headgear; made from the hat bodies, hoods or plateaux of heading no. 6501, whether or not lined or trimmed","Chapeaux et autres couvre-chefs en feutre ; fabriqués à partir des corps de chapeaux, capuchons ou plateaux du no. 6501, même doublés ou parés"
"6504","Type 12","65","04","Hats and other headgear; plaited or made by assembling strips of any material, whether or not lined or trimmed","Chapeaux et autres couvre-chefs  ; tressé ou réalisé par assemblage de bandes de toute matière, doublées ou garnies ou non"
"6505","Type 12","65","05","Hats and headgear; knitted or crocheted, or made up from lace, felt or other textile fabric in the piece (not in strips), whether or not lined or trimmed; hair-nets of any material, lined, trimmed or not","Chapeaux et couvre-chefs  ; en bonneterie ou en dentelle, feutre ou autre étoffe textile en pièces (non en bandes), même doublées ou garnies ; filets à cheveux en toutes matières, doublés, garnis ou non"
"6506","Type 12","65","06","Headgear; n.e.s. in chapter 65, whether or not lined or trimmed","Couvre-chefs  ; n.c.a. au chapitre 65, même doublés ou garnis"
"6507","Type 12","65","07","Head-bands, linings, covers, hat foundations, hat frames, peaks and chinstraps, for headgear","Bandeaux, doublures, housses, fonds de chapeaux, armatures de chapeaux, visières et jugulaires, pour chapellerie"
"6601","Type 12","66","01","Umbrellas; sun umbrellas (including walking stick umbrellas, garden umbrellas and similar umbrellas)","Parapluies ; parasols (y compris parasols cannes, parasols de jardin et parasols similaires)"
