"Code 4-digit","Section Code","Part 2-digit","Part 4-digit","Product Name","Nom du produit"
"2933","Type 6","29","33","Heterocyclic compounds with nitrogen hetero-atom(s) only; nucleic acids and their salts","Composés hétérocycliques à hétéroatome(s) d'azote uniquement  ; acides nucléiques et leurs sels"
"2934","Type 6","29","34","Heterocyclic compounds; n.e.s. in chapter 29","Composés hétérocycliques  ; n.c.a. au chapitre 29"
"2935","Type 6","29","35","Sulphonamides","Sulfamides"
"2936","Type 6","29","36","Provitamins, vitamins; natural or reproduced by synthesis (including natural concentrates) derivatives thereof used as vitamins, and intermixtures of the fore-going, whether or not in any solvent","Provitamines, vitamines ; dérivés naturels ou reproduits par synthèse (y compris les concentrés naturels) de ceux-ci utilisés comme vitamines, et mélanges de ceux-ci, dans un solvant ou non"
"2937","Type 6","29","37","Hormones, natural or reproduced by synthesis; derivatives thereof, used primarily as hormones; other steroids used primarily as hormones","Hormones, naturelles ou reproduites par synthèse ; leurs dérivés, utilisés principalement comme hormones ; autres stéroïdes utilisés principalement comme hormones"
"2938","Type 6","29","38","Glycosides, natural or reproduced by synthesis, and their salts, ethers, esters and other derivatives","Glycosides, naturels ou reproduits par synthèse, et leurs sels, éthers, esters et autres dérivés"
"2939","Type 6","29","39","Alkaloids, vegetable; natural or reproduced by synthesis, and their salts, ethers, esters and other derivatives","Alcaloïdes végétaux ; naturels ou reproduits par synthèse, et leurs sels, éthers, esters et autres dérivés"
"2940","Type 6","29","40","Sugars, chemically pure, other than sucrose, lactose, maltose, glucose or fructose; sugar ethers and sugar esters and their salts, other than products of heading no. 2937, 2938 or 2939","Sucres chimiquement purs, autres que le saccharose, le lactose, le maltose, le glucose ou le fructose  ; éthers et esters de sucres et leurs sels, autres que les produits du no. 2937, 2938 ou 2939"
"2941","Type 6","29","41","Antibiotics","Antibiotiques"
"2942","Type 6","29","42","Organic compounds; n.e.s. in chapter 29","Composés organiques ; n.c.a. au chapitre 29"
"3001","Type 6","30","01","Glands, organs (extracts, secretions thereof) for organo-therapeutic uses, dried, powdered or not; heparin and its salts; other human or animal substances for therapeutic or prophylactic uses n.e.s","Glandes, organes (extraits, sécrétions de ceux-ci) à usage organo-thérapeutique, séchés, réduits en poudre ou non ; l'héparine et ses sels ; autres substances humaines ou animales à usage thérapeutique ou prophylactique n.c.a."
"3002","Type 6","30","02","Blood, human or animal; prepared for therapeutic, prophylactic, diagnostic uses; antisera and other blood fractions; vaccines, toxins, cultures of micro organisms, similar products (not yeasts)","Sang, humain ou animal  ; préparés à des fins thérapeutiques, prophylactiques, diagnostiques ; les antisérums et autres fractions sanguines  ; vaccins, toxines, cultures de micro-organismes, produits similaires (hors levures)"
"3003","Type 6","30","03","Medicaments; (not goods of heading no. 3002, 3005 or 3006) of two or more constituents mixed together for therapeutic or prophylactic use not in measured doses or in forms or packings for retail sale","Médicaments ; (autres que les produits des nos 3002, 3005 ou 3006) de deux ou plusieurs composants mélangés ensemble à des fins thérapeutiques ou prophylactiques non dosés ni présentés dans des formes ou emballages de vente au détail"
"3004","Type 6","30","04","Medicaments; (not goods of heading no. 3002, 3005 or 3006) consisting of mixed or unmixed products for therapeutic or prophylactic use, put up in measured doses or in forms or packings for retail sale","Médicaments ; (autres que les produits des nos 3002, 3005 ou 3006) constitués de produits mélangés ou non à usage thérapeutique ou prophylactique, présentés en doses dosées ou dans des formes ou emballages de vente au détail"
"3005","Type 6","30","05","Wadding, gauze, bandages (dressings, adhesive plasters, poultices), impregnated or coated with pharmaceutical substances or in forms or packings for retail sale, for medical, surgical or veterinary use","Ouates, gazes, bandages (pansements, pansements adhésifs, cataplasmes), imprégnés ou enduits de substances pharmaceutiques ou sous formes ou emballages de vente au détail, à usage médical, chirurgical ou vétérinaire"
"3006","Type 6","30","06","Pharmaceutical goods","Produits pharmaceutiques"
"3101","Type 6","31","01","Fertilizers; animal or vegetable, whether or not mixed together or chemically treated; fertilizers produced by the mixing or chemical treatment of animal or vegetable products","Les engrais ; animaux ou végétaux, même mélangés ou traités chimiquement ; engrais produits par le mélange ou le traitement chimique de produits animaux ou végétaux"
"3102","Type 6","31","02","Fertilizers; mineral or chemical, nitrogenous","Les engrais ; minéral ou chimique, azoté"
"3103","Type 6","31","03","Fertilizers; mineral or chemical, phosphatic","Les engrais ; minéral ou chimique, phosphaté"
"3104","Type 6","31","04","Fertilizers; mineral or chemical, potassic","Les engrais ; minéral ou chimique, potassique"
"3105","Type 6","31","05","Fertilizers; mineral or chemical, containing 2 or 3 of the elements nitrogen, phosphorus, potassium; other fertilisers; goods of chapter 31 in tablets or packages of gross weight not exceeding 10kg","Les engrais ; minéral ou chimique, contenant 2 ou 3 des éléments azote, phosphore, potassium ; autres engrais ; marchandises du chapitre 31 présentées en tablettes ou en emballages d'un poids brut n'excédant pas 10 kg"
"3201","Type 6","32","01","Tanning extracts of vegetable origin; tannins and their salts, ethers, esters and other derivatives","Extraits tannants d'origine végétale ; tanins et leurs sels, éthers, esters et autres dérivés"
"3202","Type 6","32","02","Tanning substances; synthetic organic or inorganic tanning substances; tanning preparations, whether or not containing natural tanning substances, enzymatic preparations for pre-tanning","Substances tannantes ; substances tannantes synthétiques organiques ou inorganiques ; préparations tannantes, contenant ou non des substances tannantes naturelles, préparations enzymatiques pour le prétannage"
"3203","Type 6","32","03","Colouring matter of vegetable or animal origin (including dyeing extracts, not animal black); whether or not chemically defined; preparations based on colouring matter of vegetable or animal origin","Matières colorantes d'origine végétale ou animale (y compris les extraits tinctoriaux, à l'exception du noir animal) ; chimiquement défini ou non ; préparations à base de matières colorantes d'origine végétale ou animale"
"3204","Type 6","32","04","Synthetic organic colouring matter and preparations based thereon; synthetic organic products used as fluorescent brightening agents or as luminophores; whether or not chemically defined","Matières colorantes organiques synthétiques et préparations à base de celles-ci ; les produits organiques de synthèse utilisés comme azurants fluorescents ou comme luminophores ; de constitution chimique définie ou non"
"3205","Type 6","32","05","Colour lakes; preparations based on colour lakes as specified in note 3 to this chapter","Lacs de couleur ; préparations à base de laques colorantes telles que spécifiées dans la note 3 du présent chapitre"
"3206","Type 6","32","06","Colouring matter and preparations thereof n.e.s. in heading no. 3203, 3204, 3205; inorganic products, kind used as luminophores whether or not chemically defined","Matières colorantes et leurs préparations n.d.a. dans la rubrique no. 3203, 3204, 3205  ; produits inorganiques utilisés comme luminophores de constitution chimique définie ou non"
"3207","Type 6","32","07","Pigments, prepared; opacifiers, colours, vitrifiable enamels, glazes, engobes (slips), liquid lustres etc as used in the ceramic enamelling or glass industry; glass frit and powder, granules or flakes","Pigments préparés ; opacifiants, couleurs, émaux vitrifiables, glaçures, engobes (barbotines), lustres liquides, etc. utilisés dans l'industrie de l'émaillage céramique ou du verre ; fritte de verre et poudre, granulés ou flocons"
"3208","Type 6","32","08","Paints, varnishes; (enamels and lacquers) based on synthetic polymers or chemically modified natural polymers, dispersed or dissolved in a non-aqueous medium","Peintures, vernis ; (émaux et laques) à base de polymères synthétiques ou de polymères naturels modifiés chimiquement, dispersés ou dissous dans un milieu non aqueux"
"3209","Type 6","32","09","Paints and varnishes (including enamels and lacquers) based on synthetic or chemically modified natural polymers, dispersed or dissolved in an aqueous medium","Peintures et vernis (y compris les émaux et les laques) à base de polymères naturels synthétiques ou chimiquement modifiés, dispersés ou dissous dans un milieu aqueux"
"3210","Type 6","32","10","Paints and varnishes (including enamels, lacquers and distempers), excluding those of heading no. 3209, prepared water pigments of a kind used for finishing leather","Peintures et vernis (y compris les émaux, les laques et les détrempes), à l'exclusion de ceux du n°3209, pigments à l'eau préparés des types utilisés pour le finissage des cuirs"
"3211","Type 6","32","11","Driers; prepared","Séchoirs ; préparé"
"3212","Type 6","32","12","Pigments (metallic powders and flakes) dispersed in non-aqueous media in liquid or paste form, as used in manufacture of paints (including enamels); stamping foils, dyes etc in forms, packing for retail sale","Pigments (poudres et paillettes métalliques) dispersés dans des milieux non aqueux sous forme liquide ou pâteuse, utilisés dans la fabrication de peintures (y compris les émaux) ; feuilles d'estampage, colorants, etc. dans des formes, emballages pour la vente au détail"
"3213","Type 6","32","13","Colours; artists, students, or signboard painters, modifying tints, amusement colours and the like; in tablets, tubes, jars, bottles, pan or in similar forms or packings","Couleurs ; artistes, étudiants ou peintres d'enseignes, modifiant les teintes, les couleurs d'amusement et autres ; en comprimés, tubes, pots, bouteilles, moules ou sous formes ou emballages similaires"
"3214","Type 6","32","14","Glaziers' putty, grafting putty, resin cements, caulking compounds and other mastics; painters' fillings; non-refractory surfacing preparations for facades, indoor walls, floors, ceilings or the like","Mastic de vitrier, mastic de greffage, ciments résines, composés de calfeutrage et autres mastics ; mastic pour peintres ; préparations de revêtement non réfractaires pour façades, murs intérieurs, sols, plafonds ou similaires"
"3215","Type 6","32","15","Ink; printing, writing or drawing ink and other inks; whether or not concentrated or solid","Encrer ; encres d'imprimerie, d'écriture ou de dessin et autres encres ; même concentré ou solide"
"3301","Type 6","33","01","Oils; essential (concretes, absolutes); concentrates thereof in fats, fixed oils, waxes or the like (obtained by enfleurage or maceration); aqueous distillates, solutions and terpenic by-products thereof; resinoids","Huiles ; essentiels (concrets, absolus) ; leurs concentrés en graisses, huiles fixes, cires ou similaires (obtenus par enfleurage ou macération) ; distillats aqueux, solutions et sous-produits terpéniques de ceux-ci ; résinoïdes"
"3302","Type 6","33","02","Odoriferous substances and mixtures (including alcoholic solutions) with a basis of one or more of these substances, of a kind used as raw materials in industry","Substances odoriférantes et mélanges (y compris les solutions alcooliques) à base d'une ou de plusieurs de ces substances, des types utilisés comme matières de base pour l'industrie"
"3303","Type 6","33","03","Perfumes and toilet waters","Parfums et eaux de toilette"
"3304","Type 6","33","04","Cosmetic and toilet preparations; beauty, make-up and skin care preparations (excluding medicaments, including sunscreen or sun tan preparations), manicure or pedicure preparations","Produits cosmétiques et de toilette ; produits de beauté, de maquillage et de soin de la peau (à l'exception des médicaments, y compris les produits de protection solaire ou de bronzage), produits de manucure ou de pédicure"
"3305","Type 6","33","05","Hair preparations; for use on the hair","Produits capillaires ; à utiliser sur les cheveux"
"3306","Type 6","33","06","Oral or dental hygiene preparations; including fixative pastes and powders","Produits d'hygiène buccale ou dentaire ; y compris les pâtes et poudres fixatrices"
"3307","Type 6","33","07","Perfumery, cosmetic or toilet preparations; pre-shave, shaving, after-shave, bath preparations; personal deodorants and depilatories; room deodorisers, perfumed or not with disinfectant properties or not","Produits de parfumerie, cosmétiques ou de toilette ; pré-rasage, rasage, après-rasage, préparations pour le bain ; déodorants et dépilatoires personnels ; désodorisants d'ambiance, parfumés ou non, ayant ou non des propriétés désinfectantes"
"3401","Type 6","34","01","Soap; organic surface-active products and preparations for use as soap, in the form of bars, cakes, moulded pieces or shapes, containing soap or not; paper, wadding, felt and nonwovens, impregnated, coated or covered with soap or detergent","Du savon ; produits et préparations organiques tensioactifs à usage de savon, sous forme de barres, de pains, de pièces moulées ou de formes, contenant ou non du savon ; papier, ouates, feutres et nontissés, imprégnés, enduits ou recouverts de savon ou de détergent"
"3402","Type 6","34","02","Organic surface-active agents (not soap); surface-active, washing (including auxiliary washing) and cleaning preparations, containing soap or not, excluding those of heading no. 3401","Agents tensioactifs organiques (hors savon) ; préparations tensio-actives, lessives (y compris les lessives auxiliaires) et nettoyantes, contenant ou non du savon, à l'exclusion de celles du no. 3401"
"3403","Type 6","34","03","Lubricating preparations and those used in oil or grease treatment of textile and similar materials; excluding preparations containing 70% or more (by weight) of petroleum or bituminous mineral oils","Préparations lubrifiantes et celles utilisées pour le traitement à l'huile ou à la graisse des matières textiles et similaires ; à l'exclusion des préparations contenant 70 % ou plus (en poids) de pétrole ou d'huiles minérales bitumineuses"
"3404","Type 6","34","04","Waxes; artificial, prepared","Cires ; artificiel, préparé"
"3405","Type 6","34","05","Polishes, creams, scouring pastes, powders and similar; in any form, (including articles impregnated, coated or covered with such), for furniture, footwear, floors, coachwork, glass or metal","Cirages, crèmes, pâtes à récurer, poudres et similaires ; sous quelque forme que ce soit (y compris les articles qui en sont imprégnés, enduits ou recouverts), pour meubles, chaussures, sols, carrosseries, verre ou métal"
"3406","Type 6","34","06","Candles, tapers and the like","Bougies, bougies et similaires"
"3407","Type 6","34","07","Modelling pastes, including those for children; dental wax, impression compounds, in sets or packings for retail sale or in plates and similar forms; dentistry preparations with plaster base","Pâtes à modeler, y compris celles pour enfants ; cires dentaires, composés pour empreintes, en sets ou emballages pour la vente au détail ou en plaques et formes similaires ; préparations dentaires à base de plâtre"
"3501","Type 6","35","01","Casein, caseinates and other casein derivatives; casein glues","Caséine, caséinates et autres dérivés de caséine  ; colles de caséine"
"3502","Type 6","35","02","Albumins; albuminates and other albumin derivatives","Albumines ; albuminates et autres dérivés de l'albumine"
"3503","Type 6","35","03","Gelatin (including gelatin in rectangular sheets, whether or not surface-worked or coloured) and gelatin derivatives; isinglass; other glues of animal origin, excluding casein glues of heading no. 3501","Gélatine (y compris la gélatine en feuilles rectangulaires, même travaillée en surface ou colorée) et ses dérivés ; ichtyocolle ; autres colles d'origine animale, à l'exclusion des colles de caséine du no. 3501"
"3504","Type 6","35","04","Peptones and their derivatives; other protein substances and their derivatives n.e.s. or included; hide powder, whether or not chromed","Peptones et leurs dérivés ; autres substances protéiques et leurs dérivés n.c.a. ou inclus  ; poudre de peau, chromée ou non"
"3505","Type 6","35","05","Dextrins and other modified starches (eg pregelatinised or esterified starches); glues based on starches or on dextrins or other modified starches","Dextrines et autres amidons modifiés (par exemple amidons prégélatinisés ou estérifiés) ; colles à base d'amidons ou de dextrines ou d'autres amidons modifiés"
"3506","Type 6","35","06","Prepared glues and other prepared adhesives, n.e.s. or included; products suitable for use as glues or adhesives, put up for retail sale as glues or adhesives, not exceeding 1kg net weight","Colles préparées et autres adhésifs préparés, n.d.a. ou inclus  ; produits utilisables comme colles ou adhésifs, conditionnés pour la vente au détail comme colles ou adhésifs, d'un poids net n'excédant pas 1 kg"
"3507","Type 6","35","07","Enzymes; prepared enzymes not elsewhere specified or included","Enzymes ; enzymes préparées non dénommées ni comprises ailleurs"
"3601","Type 6","36","01","Explosives; propellent powders","Explosifs  ; poudres propulsives"
"3602","Type 6","36","02","Prepared explosives, other than propellent powders","Explosifs préparés, autres que les poudres propulsives"
"3603","Type 6","36","03","Safety fuses; detonating fuses; percussion or detonating caps; igniters; electric detonators","Fusibles de sécurité  ; mèches détonantes ; amorces à percussion ou détonantes ; allumeurs ; détonateurs électriques"
"3604","Type 6","36","04","Fireworks, signalling flares, rain rockets, fog signals and other pyrotechnic articles","Feux d'artifice, fusées de signalisation, fusées anti-pluie, signaux de brume et autres articles pyrotechniques"
"3605","Type 6","36","05","Matches; other than pyrotechnic articles of heading no. 3604","Allumettes ; autres que les articles pyrotechniques du no. 3604"
"3606","Type 6","36","06","Ferro-cerium and other pyrophoric alloys in all forms; articles of combustible materials n.e.s. in chapter 36","Ferrocérium et autres alliages pyrophoriques sous toutes leurs formes ; articles en matières combustibles n.d.a. au chapitre 36"
"3701","Type 6","37","01","Photographic plates and film in the flat, sensitised, unexposed, of any material other than paper, paperboard or textiles; instant print film in the flat, sensitised, unexposed, whether or not in packs","Plaques et pellicules photographiques à plat, sensibilisées, non exposées, en toute matière autre que papier, carton ou textile ; film à tirage instantané à plat, sensibilisé, non exposé, en pack ou non"
"3702","Type 6","37","02","Photographic film in rolls, sensitised, unexposed, of any material other than paper, paperboard or textiles; instant print film in rolls, sensitised, unexposed","Films photographiques en rouleaux, sensibilisés, non exposés, en toute matière autre que papier, carton ou textile ; film d'impression instantanée en rouleaux, sensibilisé, non exposé"
"3703","Type 6","37","03","Photographic paper, paperboard and textiles; sensitised, unexposed","Papier, carton et textiles photographiques ; sensibilisé, non exposé"
"3704","Type 6","37","04","Photographic plates, film, paper, paperboard and textiles, exposed but not developed","Plaques photographiques, films, papiers, cartons et textiles, exposés mais non développés"
"3705","Type 6","37","05","Photographic plates and film; exposed and developed, other than cinematographic film","Plaques et films photographiques ; exposés et développés, autres que les films cinématographiques"
"3706","Type 6","37","06","Cinematographic film; exposed and developed, whether or not incorporating sound track or consisting only of sound track","Film cinématographique ; exposés et développés, incorporant ou non une bande sonore ou consistant uniquement en une bande sonore"
"3707","Type 6","37","07","Chemical preparations for photographic uses (other than varnishes, glues, adhesives and similar preparations); unmixed products for photographic uses, put up in measured portions or for retail sale","Produits chimiques à usage photographique (autres que vernis, colles, adhésifs et préparations similaires) ; produits non mélangés à usage photographique, conditionnés en portions mesurées ou pour la vente au détail"
"3801","Type 6","38","01","Artificial graphite; colloidal or semi-colloidal graphite; preparations based on graphite or other carbon in the form of pastes, blocks, plates or other semi-manufactures","Graphite artificiel ; le graphite colloïdal ou semi-colloïdal ; préparations à base de graphite ou d'autre carbone sous forme de pâtes, de blocs, de plaques ou d'autres demi-produits"
"3802","Type 6","38","02","Activated carbon; activated natural mineral products; animal black, including spent animal black","Charbon actif ; produits minéraux naturels activés ; noir animal, y compris noir animal usé"
"3803","Type 6","38","03","Tall oil, whether or not refined","Tall oil, raffiné ou non"
"3804","Type 6","38","04","Residual lyes from the manufacture of wood pulp, whether or not concentrated, desugared or chemically treated, including lignin sulphonates, but excluding tall oil of heading no. 3803","Lessives résiduelles de la fabrication de la pâte de bois, même concentrées, désucrées ou traitées chimiquement, y compris les sulfonates de lignine, mais à l'exclusion du tall oil du no. 3803"
"3805","Type 6","38","05","Gum, wood or sulphate turpentine, other turpenic oils; crude dipentene; sulphite turpentine, other crude para-cymene; pine oil containing alpha-terpineol as the main constituent","Essence de térébenthine à base de gomme, de bois ou de sulfate, autres essences de térébenthine ; dipentène brut ; essence de térébenthine au bisulfite, autre paracymène brut ; huile de pin contenant de l'alpha-terpinéol comme constituant principal"
"3806","Type 6","38","06","Rosin and resin acids and derivatives thereof; rosin spirit and rosin oils; run gums","Colophanes et acides résiniques et leurs dérivés ; essence de colophane et huiles de colophane ; courir les gencives"
"3807","Type 6","38","07","Wood tar; wood tar oils; wood creosote; wood naphtha; vegetable pitch; brewers' pitch and similar preparations based on rosin, resin acids or on vegetable pitch","Goudron de bois ; huiles de goudron de bois ; créosote de bois ; naphta de bois ; poix de légumes ; poix de brasserie et préparations similaires à base de colophane, d'acides résiniques ou de poix végétales"
"3808","Type 6","38","08","Insecticides, rodenticides, fungicides, herbicides, anti-sprouting products, plant growth regulators, disinfectants and the like, in forms or packings for retail sale or as preparations or articles","Insecticides, rodenticides, fongicides, herbicides, inhibiteurs de germination, régulateurs de croissance pour plantes, désinfectants et similaires, sous formes ou emballages de vente au détail ou en tant que préparations ou articles"
"3809","Type 6","38","09","Finishing agents, dye carriers to accelerate the dyeing, fixing of dyestuffs, other products and preparations, of a kind used in the textile, paper, leather or like industries, n.e.s. or included","Agents de finissage, supports de teinture pour accélérer la teinture, fixer les matières colorantes, autres produits et préparations, des types utilisés pour les industries du textile, du papier, du cuir ou similaires, n.d.a. ou inclus"
"3810","Type 6","38","10","Metal-pickling preparations; fluxes etc for soldering, brazing; welding powders, pastes of metal and other materials; preparations used as cores or coatings for welding electrodes or rods","Préparations pour le décapage des métaux ; flux, etc. pour le soudage, le brasage  ; poudres à souder, pâtes métalliques et autres matériaux ; préparations utilisées comme noyaux ou revêtements pour les électrodes ou les baguettes de soudage"
"3811","Type 6","38","11","Anti-knock preparations, oxidation and gum inhibitors, viscosity improvers, anti-corrosive preparations and the like, for mineral oils (including gasoline) or other liquids used for the same purposes","Préparations antidétonantes, inhibiteurs d'oxydation et de gomme, améliorants de viscosité, préparations anticorrosives et similaires, pour huiles minérales (y compris l'essence) ou autres liquides utilisés aux mêmes fins"
"3812","Type 6","38","12","Prepared rubber accelerators; compound plasticisers for rubber or plastics, n.e.s. or included; anti-oxidising preparations and other compound stabilisers for rubber or plastics","Accélérateurs en caoutchouc préparés ; plastifiants composites pour caoutchouc ou matières plastiques, n.d.a. ou inclus  ; préparations antioxydantes et autres stabilisants composites pour caoutchouc ou matières plastiques"
